{
  "version": 2,
  "reviewer_kind": "human",
  "condition_mapping_known": false,
  "scores": {
    "version_a": {"task_fit": null, "information_hierarchy": null, "mobile_usability": null, "control_discoverability": null, "density": null, "visual_coherence": null, "repository_consistency": null, "component_reuse": null, "accessibility": null, "implementation_restraint": null, "desktop_regression_risk": null, "ship_readiness": null},
    "version_b": {"task_fit": null, "information_hierarchy": null, "mobile_usability": null, "control_discoverability": null, "density": null, "visual_coherence": null, "repository_consistency": null, "component_reuse": null, "accessibility": null, "implementation_restraint": null, "desktop_regression_risk": null, "ship_readiness": null}
  },
  "ship_choice": "not-scored",
  "evidence": [],
  "status": "not-scored"
}
