{
  "version": 2,
  "reviewer_kind": "ai-delegated",
  "condition_mapping_known": false,
  "scores": {
    "version_a": {
      "task_fit": 3,
      "information_hierarchy": 4,
      "mobile_usability": 3,
      "control_discoverability": 3,
      "density": 4,
      "visual_coherence": 4,
      "repository_consistency": 4,
      "component_reuse": 4,
      "accessibility": 4,
      "implementation_restraint": 4,
      "desktop_regression_risk": 2,
      "ship_readiness": 2
    },
    "version_b": {
      "task_fit": 5,
      "information_hierarchy": 5,
      "mobile_usability": 5,
      "control_discoverability": 5,
      "density": 4,
      "visual_coherence": 5,
      "repository_consistency": 4,
      "component_reuse": 4,
      "accessibility": 5,
      "implementation_restraint": 5,
      "desktop_regression_risk": 5,
      "ship_readiness": 5
    }
  },
  "ship_choice": "B",
  "evidence": [
    "Anonymous screenshots at 390x844, 768x1024, and 1440x1000.",
    "Anonymous interaction, CSV-load-failure, overflow, console/page-error, and axe evidence.",
    "Version B has an explicit mobile control hierarchy and passes all required viewport checks.",
    "Version A retains 7px horizontal overflow at 768px and cannot be considered ship-ready."
  ],
  "status": "complete"
}
